{"document_type":"danio_autonomous_completion_rehearsal_report","schema_version":1,"rehearsal_run_id":"task12-rehearsal-2026-07-13","task_id":"019f58f9-fbeb-74c0-9d76-9b9fcc048b49","created_at_utc":"2026-07-13T01:49:49.6529814Z","repository_root":"C:/Users/larki/OneDrive/Documents/App Projects/Danio Aquarium App Project/repo","base_commit":"6de2ec029b21ccb436ca931c1d60dfcd8c2fa064","proposed":{"autonomous_units":12,"work_unit_id":"WF-2026-07-11-015","ledger_row_ids":["DCL-DR-001"]},"before":{"status_sha256":"7352f697376c427cab4644e8203d059a2ef22a924d107f21aa4e46fe51584aec","index_tree":"efdc0f5176959b73d32de22422666666d8da8ec3","local_refs_sha256":"590bd9ba430d1d7cb024dfc3935fa5364160140caad249a5c6b38dc6f82b2340","remote_refs_sha256":"c0408b1b637eff863256f7bead6d3fe89cfa1dea7ab98fc232476683349a539b","worktrees_sha256":"bb16b9a6b054c50c2ec6f85e84e68b3203a320acee60cb084812f48c6a963e88"},"after":{"status_sha256":"7352f697376c427cab4644e8203d059a2ef22a924d107f21aa4e46fe51584aec","index_tree":"efdc0f5176959b73d32de22422666666d8da8ec3","local_refs_sha256":"590bd9ba430d1d7cb024dfc3935fa5364160140caad249a5c6b38dc6f82b2340","remote_refs_sha256":"c0408b1b637eff863256f7bead6d3fe89cfa1dea7ab98fc232476683349a539b","worktrees_sha256":"bb16b9a6b054c50c2ec6f85e84e68b3203a320acee60cb084812f48c6a963e88"},"previews":{"launch":{"eligible":false,"code":"LAUNCH_NOT_AUTHORIZED","mutations_performed":false},"claim":{"eligible":false,"code":"AUTHORITY_CONFLICT","mutations_performed":false},"closeout":{"eligible":false,"code":"AUTHORITY_CONFLICT","mutations_performed":false}},"mutations":{"repository_files":false,"index":false,"local_refs":false,"remote_refs":false,"worktrees":false,"successor_tasks":false,"android_runtime":false,"figma":false,"external_services":false},"overall_status":"pass"}
